Timestamp,Interface,Source_IP:Port,Destination_IP:Port,Protocol,Length
2025-12-08 16:11:58.395352 hdst-eth0 In  ARP, Request who-has 192.168.1.4 tell 0.0.0.0, length 28
2025-12-08 16:11:58.411880 hdst-eth0 In  IP 192.168.1.4 > 224.0.0.22: igmp
2025-12-08 16:11:58.426459 hdst-eth0 In  IP6 :: > ff02::1:ff0b:314a: ICMP6, neighbor solicitation, who has fe80::4dce:8485:1e0b:314a, length 24
2025-12-08 16:11:58.442537 hdst-eth0 In  IP6 fe80::4dce:8485:1e0b:314a > ff02::2: ICMP6, router solicitation, length 16
2025-12-08 16:11:58.467764 hdst-eth0 In  IP 10.250.18.18.48036 > 150.244.64.1.8889: tcp 0
2025-12-08 16:11:58.482653 hdst-eth0 In  IP 150.244.64.1.8889 > 10.250.18.18.48036: tcp 0
2025-12-08 16:11:58.498642 hdst-eth0 In  IP 10.250.18.18.48036 > 150.244.64.1.8889: tcp 0
2025-12-08 16:11:58.517759 hdst-eth0 In  IP 150.244.64.1.8889 > 10.250.18.18.48036: tcp 76
2025-12-08 16:11:58.533694 hdst-eth0 In  IP 10.250.18.18.48036 > 150.244.64.1.8889: tcp 0
2025-12-08 16:11:58.550064 hdst-eth0 In  IP 10.250.18.18.48036 > 150.244.64.1.8889: tcp 90
2025-12-08 16:11:58.565644 hdst-eth0 In  IP 150.244.64.1.8889 > 10.250.18.18.48036: tcp 0
2025-12-08 16:11:58.583756 hdst-eth0 In  IP 150.244.64.1.8889 > 10.250.18.18.48036: tcp 0
2025-12-08 16:11:58.600657 hdst-eth0 In  IP 10.250.18.18.48036 > 150.244.64.1.8889: tcp 0
2025-12-08 16:11:58.615527 hdst-eth0 In  IP 150.244.64.1.8889 > 10.250.18.18.48036: tcp 0
2025-12-08 16:11:58.632026 hdst-eth0 In  Loopback, skipCount 32769 (bogus) (invalid)
2025-12-08 16:11:58.646916 hdst-eth0 In  IP 10.250.18.18.41388 > 150.244.214.200.53: UDP, length 32
2025-12-08 16:11:58.671740 hdst-eth0 In  IP6 fe80::4dce:8485:1e0b:314a > ff02::16: HBH ICMP6, multicast listener report v2, 2 group record(s), length 48
2025-12-08 16:11:58.693877 hdst-eth0 In  IP 192.168.1.4 > 224.0.0.22: igmp
2025-12-08 16:11:58.710950 hdst-eth0 In  IP6 fe80::4dce:8485:1e0b:314a > ff02::16: HBH ICMP6, multicast listener report v2, 2 group record(s), length 48
2025-12-08 16:11:58.733764 hdst-eth0 In  ARP, Request who-has 192.168.1.4 tell 0.0.0.0, length 28
2025-12-08 16:11:58.757139 hdst-eth0 In  IP 150.244.214.200.53 > 10.250.18.18.41388: UDP, length 48
2025-12-08 16:11:58.783555 hdst-eth0 In  IP 10.250.18.18.41388 > 150.244.214.200.53: UDP, length 32
2025-12-08 16:11:58.807176 hdst-eth0 In  IP 150.244.214.200.53 > 10.250.18.18.41388: UDP, length 60
2025-12-08 16:11:58.829950 hdst-eth0 In  IP 10.250.18.18.58344 > 150.244.64.23.53: UDP, length 33
2025-12-08 16:11:58.856917 hdst-eth0 In  IP6 fe80::4dce:8485:1e0b:314a > ff02::16: HBH ICMP6, multicast listener report v2, 1 group record(s), length 28
2025-12-08 16:11:58.883016 hdst-eth0 In  IP 192.168.1.4 > 224.0.0.22: igmp
2025-12-08 16:11:58.904946 hdst-eth0 In  IP6 fe80::4dce:8485:1e0b:314a.49352 > ff02::1:3.5355: UDP, length 21
2025-12-08 16:11:58.937229 hdst-eth0 In  IP 192.168.1.4.49691 > 224.0.0.252.5355: UDP, length 21
2025-12-08 16:11:58.956179 hdst-eth0 In  IP 150.244.64.23.53 > 10.250.18.18.58344: UDP, length 33
2025-12-08 16:11:58.975140 hdst-eth0 In  IP 10.250.18.18.48046 > 150.244.64.1.8889: tcp 0
2025-12-08 16:11:58.992961 hdst-eth0 In  IP 150.244.64.1.8889 > 10.250.18.18.48046: tcp 0
2025-12-08 16:11:59.008951 hdst-eth0 In  IP 10.250.18.18.48046 > 150.244.64.1.8889: tcp 0
2025-12-08 16:11:59.041402 hdst-eth0 In  IP 150.244.64.1.8889 > 10.250.18.18.48046: tcp 76
2025-12-08 16:11:59.059821 hdst-eth0 In  IP 10.250.18.18.48046 > 150.244.64.1.8889: tcp 0
2025-12-08 16:11:59.079775 hdst-eth0 In  IP 10.250.18.18.48046 > 150.244.64.1.8889: tcp 90
2025-12-08 16:11:59.097782 hdst-eth0 In  IP 150.244.64.1.8889 > 10.250.18.18.48046: tcp 0
2025-12-08 16:11:59.115893 hdst-eth0 In  IP 192.168.1.4.63735 > 239.255.255.250.1900: UDP, length 133
2025-12-08 16:11:59.131584 hdst-eth0 In  ARP, Request who-has 192.168.1.1 tell 192.168.1.4, length 28
2025-12-08 16:11:59.146644 hdst-eth0 In  ARP, Reply 192.168.1.1 is-at 52:54:00:12:35:00, length 28
2025-12-08 16:11:59.165991 hdst-eth0 In  IP 192.168.1.4.61237 > 8.8.8.8.53: UDP, length 34
2025-12-08 16:11:59.193250 hdst-eth0 In  IP6 fe80::4dce:8485:1e0b:314a.49352 > ff02::1:3.5355: UDP, length 21
2025-12-08 16:11:59.209086 hdst-eth0 In  IP 192.168.1.4.49691 > 224.0.0.252.5355: UDP, length 21
2025-12-08 16:11:59.222778 hdst-eth0 In  IP 192.168.1.4 > 224.0.0.22: igmp
2025-12-08 16:11:59.237993 hdst-eth0 In  IP6 fe80::4dce:8485:1e0b:314a > ff02::16: HBH ICMP6, multicast listener report v2, 1 group record(s), length 28
2025-12-08 16:11:59.257059 hdst-eth0 In  IP 150.244.64.1.8889 > 10.250.18.18.48046: tcp 0
2025-12-08 16:11:59.274974 hdst-eth0 In  IP 10.250.18.18.48046 > 150.244.64.1.8889: tcp 0
2025-12-08 16:11:59.305078 hdst-eth0 In  IP 150.244.64.1.8889 > 10.250.18.18.48046: tcp 0
2025-12-08 16:11:59.318821 hdst-eth0 In  ifindex 2 00:00:00:00:01:01 
2025-12-08 16:11:59.339524 hdst-eth0 In  Loopback, skipCount 32769 (bogus) (invalid)
2025-12-08 16:11:59.363143 hdst-eth0 In  IP 10.250.18.18.48052 > 150.244.64.1.8889: tcp 0
2025-12-08 16:11:59.377873 hdst-eth0 In  IP 150.244.64.1.8889 > 10.250.18.18.48052: tcp 0
2025-12-08 16:11:59.392896 hdst-eth0 In  IP 10.250.18.18.48052 > 150.244.64.1.8889: tcp 0
2025-12-08 16:11:59.412728 hdst-eth0 In  ARP, Request who-has 192.168.1.4 tell 0.0.0.0, length 28
2025-12-08 16:11:59.438271 hdst-eth0 In  IP 192.168.1.4.61237 > 8.8.8.8.53: UDP, length 34
2025-12-08 16:11:59.453782 hdst-eth0 In  IP6 fe80::4dce:8485:1e0b:314a > ff02::1:ff16:a07a: ICMP6, neighbor solicitation, who has fe80::7144:1beb:fc16:a07a, length 32
2025-12-08 16:11:59.468869 hdst-eth0 In  IP6 fe80::4dce:8485:1e0b:314a.63733 > ff02::c.1900: UDP, length 146
2025-12-08 16:11:59.488053 hdst-eth0 In  IP 150.244.64.1.8889 > 10.250.18.18.48052: tcp 76
2025-12-08 16:11:59.507130 hdst-eth0 In  IP 10.250.18.18.48052 > 150.244.64.1.8889: tcp 0
2025-12-08 16:11:59.522161 hdst-eth0 In  IP 10.250.18.18.48052 > 150.244.64.1.8889: tcp 90
2025-12-08 16:11:59.535949 hdst-eth0 In  IP 150.244.64.1.8889 > 10.250.18.18.48052: tcp 0
2025-12-08 16:11:59.560177 hdst-eth0 In  IP 150.244.64.1.8889 > 10.250.18.18.48052: tcp 0
2025-12-08 16:11:59.574867 hdst-eth0 In  IP 10.250.18.18.48052 > 150.244.64.1.8889: tcp 0
2025-12-08 16:11:59.589109 hdst-eth0 In  IP 150.244.64.1.8889 > 10.250.18.18.48052: tcp 0
2025-12-08 16:11:59.605290 hdst-eth0 In  Loopback, skipCount 32769 (bogus) (invalid)
2025-12-08 16:11:59.631813 hdst-eth0 In  IP 10.250.18.18.41944 > 34.117.188.166.443: tcp 0
2025-12-08 16:11:59.644000 hdst-eth0 In  IP 34.117.188.166.443 > 10.250.18.18.41944: tcp 0
2025-12-08 16:11:59.658337 hdst-eth0 In  IP 10.250.18.18.41944 > 34.117.188.166.443: tcp 0
2025-12-08 16:11:59.675350 hdst-eth0 In  IP 10.250.18.18.41944 > 34.117.188.166.443: tcp 1252
2025-12-08 16:11:59.698676 hdst-eth0 In  IP6 fe80::4dce:8485:1e0b:314a > ff02::1:ff16:a07a: ICMP6, neighbor solicitation, who has fe80::7144:1beb:fc16:a07a, length 32
2025-12-08 16:11:59.716290 hdst-eth0 In  IP6 fe80::4dce:8485:1e0b:314a > ff02::16: HBH ICMP6, multicast listener report v2, 1 group record(s), length 28
2025-12-08 16:11:59.737004 hdst-eth0 In  IP 192.168.1.4 > 224.0.0.22: igmp
2025-12-08 16:11:59.760013 hdst-eth0 In  IP6 fe80::4dce:8485:1e0b:314a > ff02::16: HBH ICMP6, multicast listener report v2, 1 group record(s), length 28
2025-12-08 16:11:59.790950 hdst-eth0 In  IP 34.117.188.166.443 > 10.250.18.18.41944: tcp 0
2025-12-08 16:11:59.814228 hdst-eth0 In  IP 34.117.188.166.443 > 10.250.18.18.41944: tcp 212
2025-12-08 16:11:59.829877 hdst-eth0 In  IP 10.250.18.18.41944 > 34.117.188.166.443: tcp 0
2025-12-08 16:11:59.845091 hdst-eth0 In  IP 10.250.18.18.41944 > 34.117.188.166.443: tcp 64
2025-12-08 16:11:59.869060 hdst-eth0 In  IP 10.250.18.18.41944 > 34.117.188.166.443: tcp 92
2025-12-08 16:11:59.888415 hdst-eth0 In  IP 10.250.18.18.41944 > 34.117.188.166.443: tcp 198
2025-12-08 16:11:59.903104 hdst-eth0 In  IP 34.117.188.166.443 > 10.250.18.18.41944: tcp 618
2025-12-08 16:11:59.916899 hdst-eth0 In  IP 34.117.188.166.443 > 10.250.18.18.41944: tcp 0
2025-12-08 16:11:59.938166 hdst-eth0 In  IP 34.117.188.166.443 > 10.250.18.18.41944: tcp 31
2025-12-08 16:11:59.959924 hdst-eth0 In  IP 10.250.18.18.41944 > 34.117.188.166.443: tcp 0
2025-12-08 16:11:59.978093 hdst-eth0 In  IP 10.250.18.18.41944 > 34.117.188.166.443: tcp 31
2025-12-08 16:11:59.997017 hdst-eth0 In  IP 34.117.188.166.443 > 10.250.18.18.41944: tcp 0
2025-12-08 16:12:00.022255 hdst-eth0 In  IP 34.117.188.166.443 > 10.250.18.18.41944: tcp 172
2025-12-08 16:12:00.041074 hdst-eth0 In  IP 34.117.188.166.443 > 10.250.18.18.41944: tcp 1400
2025-12-08 16:12:00.060930 hdst-eth0 In  IP 10.250.18.18.41944 > 34.117.188.166.443: tcp 0
2025-12-08 16:12:00.077026 hdst-eth0 In  IP 34.117.188.166.443 > 10.250.18.18.41944: tcp 1400
2025-12-08 16:12:00.094011 hdst-eth0 In  IP 34.117.188.166.443 > 10.250.18.18.41944: tcp 1400
2025-12-08 16:12:00.113920 hdst-eth0 In  IP 10.250.18.18.41944 > 34.117.188.166.443: tcp 0
2025-12-08 16:12:00.130044 hdst-eth0 In  IP 34.117.188.166.443 > 10.250.18.18.41944: tcp 1057
2025-12-08 16:12:00.148010 hdst-eth0 In  IP 34.117.188.166.443 > 10.250.18.18.41944: tcp 39
2025-12-08 16:12:00.180824 hdst-eth0 In  IP 192.168.1.4 > 224.0.0.22: igmp
2025-12-08 16:12:00.198930 hdst-eth0 In  IP6 fe80::4dce:8485:1e0b:314a.53227 > ff02::1:3.5355: UDP, length 21
2025-12-08 16:12:00.214720 hdst-eth0 In  IP 192.168.1.4.55418 > 224.0.0.252.5355: UDP, length 21
2025-12-08 16:12:00.230122 hdst-eth0 In  IP 192.168.1.4.137 > 192.168.1.255.137: UDP, length 68
2025-12-08 16:12:00.253345 hdst-eth0 In  IP 192.168.1.4.61237 > 8.8.8.8.53: UDP, length 34
2025-12-08 16:12:00.278082 hdst-eth0 In  IP6 fe80::4dce:8485:1e0b:314a.53227 > ff02::1:3.5355: UDP, length 21
2025-12-08 16:12:00.296457 hdst-eth0 In  IP 192.168.1.4.55418 > 224.0.0.252.5355: UDP, length 21
2025-12-08 16:12:00.326371 hdst-eth0 In  IP 192.168.1.4.137 > 192.168.1.255.137: UDP, length 68
2025-12-08 16:12:00.355870 hdst-eth0 In  IP 10.250.18.18.41944 > 34.117.188.166.443: tcp 0
2025-12-08 16:12:00.383153 hdst-eth0 In  IP 10.250.18.18.41944 > 34.117.188.166.443: tcp 39
2025-12-08 16:12:00.403874 hdst-eth0 In  IP 34.117.188.166.443 > 10.250.18.18.41944: tcp 0
2025-12-08 16:12:00.418882 hdst-eth0 In  IP 10.250.18.18.48058 > 150.244.64.1.8889: tcp 0
2025-12-08 16:12:00.439037 hdst-eth0 In  IP 150.244.64.1.8889 > 10.250.18.18.48058: tcp 0
2025-12-08 16:12:00.463184 hdst-eth0 In  IP 10.250.18.18.48058 > 150.244.64.1.8889: tcp 0
2025-12-08 16:12:00.494206 hdst-eth0 In  IP 150.244.64.1.8889 > 10.250.18.18.48058: tcp 76
2025-12-08 16:12:00.515146 hdst-eth0 In  IP 10.250.18.18.48058 > 150.244.64.1.8889: tcp 0
2025-12-08 16:12:00.541733 hdst-eth0 In  IP 10.250.18.18.48058 > 150.244.64.1.8889: tcp 90
2025-12-08 16:12:00.566952 hdst-eth0 In  IP 150.244.64.1.8889 > 10.250.18.18.48058: tcp 0
2025-12-08 16:12:00.584880 hdst-eth0 In  IP 150.244.64.1.8889 > 10.250.18.18.48058: tcp 0
2025-12-08 16:12:00.601031 hdst-eth0 In  IP 10.250.18.18.48058 > 150.244.64.1.8889: tcp 0
2025-12-08 16:12:00.633393 hdst-eth0 In  IP 192.168.1.4.137 > 192.168.1.255.137: UDP, length 68
2025-12-08 16:12:00.650957 hdst-eth0 In  IP6 fe80::4dce:8485:1e0b:314a.53514 > ff02::1:3.5355: UDP, length 24
2025-12-08 16:12:00.668996 hdst-eth0 In  IP 192.168.1.4.53196 > 224.0.0.252.5355: UDP, length 24
2025-12-08 16:12:00.695384 hdst-eth0 In  IP 192.168.1.4.49885 > 8.8.8.8.53: UDP, length 43
2025-12-08 16:12:00.722884 hdst-eth0 In  IP6 fe80::4dce:8485:1e0b:314a.53514 > ff02::1:3.5355: UDP, length 24
2025-12-08 16:12:00.740031 hdst-eth0 In  IP 192.168.1.4.53196 > 224.0.0.252.5355: UDP, length 24
2025-12-08 16:12:00.755087 hdst-eth0 In  IP 192.168.1.4.137 > 192.168.1.255.137: UDP, length 50
2025-12-08 16:12:00.769739 hdst-eth0 In  IP 192.168.1.4 > 224.0.0.22: igmp
2025-12-08 16:12:00.793225 hdst-eth0 In  IP6 fe80::4dce:8485:1e0b:314a > ff02::16: HBH ICMP6, multicast listener report v2, 1 group record(s), length 28
2025-12-08 16:12:00.813172 hdst-eth0 In  IP 192.168.1.4.137 > 192.168.1.255.137: UDP, length 68
2025-12-08 16:12:00.828356 hdst-eth0 In  IP 192.168.1.4.137 > 192.168.1.255.137: UDP, length 68
2025-12-08 16:12:00.843149 hdst-eth0 In  IP 192.168.1.4.137 > 192.168.1.255.137: UDP, length 68
2025-12-08 16:12:00.861854 hdst-eth0 In  IP 150.244.64.1.8889 > 10.250.18.18.48058: tcp 0
2025-12-08 16:12:00.877891 hdst-eth0 In  Loopback, skipCount 32769 (bogus) (invalid)
2025-12-08 16:12:00.894349 hdst-eth0 In  IP 10.250.18.18.59648 > 150.244.214.200.53: UDP, length 33
2025-12-08 16:12:00.912294 hdst-eth0 In  IP 150.244.214.200.53 > 10.250.18.18.59648: UDP, length 49
2025-12-08 16:12:00.930847 hdst-eth0 In  IP6 fe80::4dce:8485:1e0b:314a > ff02::1:ff16:a07a: ICMP6, neighbor solicitation, who has fe80::7144:1beb:fc16:a07a, length 32
2025-12-08 16:12:00.946249 hdst-eth0 In  IP6 fe80::4dce:8485:1e0b:314a > ff02::2: ICMP6, router solicitation, length 16
2025-12-08 16:12:00.962552 hdst-eth0 In  IP 192.168.1.4.63735 > 239.255.255.250.1900: UDP, length 133
2025-12-08 16:12:00.983450 hdst-eth0 In  IP 192.168.1.4.49885 > 8.8.8.8.53: UDP, length 43
2025-12-08 16:12:01.003805 hdst-eth0 In  IP 192.168.1.4.137 > 192.168.1.255.137: UDP, length 50
2025-12-08 16:12:01.017584 hdst-eth0 In  IP 192.168.1.4.137 > 192.168.1.255.137: UDP, length 68
2025-12-08 16:12:01.031745 hdst-eth0 In  IP 192.168.1.4.137 > 192.168.1.255.137: UDP, length 68
2025-12-08 16:12:01.044743 hdst-eth0 In  IP 192.168.1.4.137 > 192.168.1.255.137: UDP, length 68
2025-12-08 16:12:01.066389 hdst-eth0 In  IP 192.168.1.4.137 > 192.168.1.255.137: UDP, length 50
2025-12-08 16:12:01.084149 hdst-eth0 In  IP 192.168.1.4.61237 > 8.8.8.8.53: UDP, length 34
2025-12-08 16:12:01.100262 hdst-eth0 In  IP 192.168.1.4.49885 > 8.8.8.8.53: UDP, length 43
2025-12-08 16:12:01.115144 hdst-eth0 In  IP 192.168.1.4.137 > 192.168.1.255.137: UDP, length 68
2025-12-08 16:12:01.141208 hdst-eth0 In  IP 10.250.18.18.59648 > 150.244.214.200.53: UDP, length 33
2025-12-08 16:12:01.156209 hdst-eth0 In  IP 150.244.214.200.53 > 10.250.18.18.59648: UDP, length 61
2025-12-08 16:12:01.170543 hdst-eth0 In  ifindex 2 00:00:00:00:01:01 
2025-12-08 16:12:01.184879 hdst-eth0 In  IP 10.250.18.18.48064 > 150.244.64.1.8889: tcp 0
2025-12-08 16:12:01.210518 hdst-eth0 In  IP 192.168.1.4.137 > 192.168.1.255.137: UDP, length 68
2025-12-08 16:12:01.231158 hdst-eth0 In  IP 192.168.1.4.137 > 192.168.1.255.137: UDP, length 68
2025-12-08 16:12:01.249814 hdst-eth0 In  IP6 fe80::4dce:8485:1e0b:314a.63733 > ff02::c.1900: UDP, length 146
2025-12-08 16:12:01.264799 hdst-eth0 In  IP6 fe80::4dce:8485:1e0b:314a > ff02::1:ff16:a07a: ICMP6, neighbor solicitation, who has fe80::7144:1beb:fc16:a07a, length 32
2025-12-08 16:12:01.293513 hdst-eth0 In  IP 192.168.1.4.137 > 192.168.1.255.137: UDP, length 68
2025-12-08 16:12:01.315130 hdst-eth0 In  IP6 fe80::4dce:8485:1e0b:314a > ff02::1:ff16:a07a: ICMP6, neighbor solicitation, who has fe80::7144:1beb:fc16:a07a, length 32
2025-12-08 16:12:01.331313 hdst-eth0 In  IP 192.168.1.4.137 > 192.168.1.255.137: UDP, length 68
2025-12-08 16:12:01.350934 hdst-eth0 In  IP 192.168.1.4.63735 > 239.255.255.250.1900: UDP, length 133
2025-12-08 16:12:01.388528 hdst-eth0 In  IP 192.168.1.4.49885 > 8.8.8.8.53: UDP, length 43
2025-12-08 16:12:01.403791 hdst-eth0 In  IP6 fe80::4dce:8485:1e0b:314a > ff02::1:ff16:a07a: ICMP6, neighbor solicitation, who has fe80::7144:1beb:fc16:a07a, length 32
2025-12-08 16:12:01.423141 hdst-eth0 In  IP 192.168.1.4.137 > 192.168.1.255.137: UDP, length 68
2025-12-08 16:12:01.437814 hdst-eth0 In  IP6 fe80::4dce:8485:1e0b:314a > ff02::2: ICMP6, router solicitation, length 16
2025-12-08 16:12:01.468332 hdst-eth0 In  IP 192.168.1.4.137 > 192.168.1.255.137: UDP, length 68
2025-12-08 16:12:01.490470 hdst-eth0 In  IP 192.168.1.4.61237 > 8.8.8.8.53: UDP, length 34
2025-12-08 16:12:01.513802 hdst-eth0 In  IP 192.168.1.4.138 > 192.168.1.255.138: UDP, length 174
2025-12-08 16:12:01.529173 hdst-eth0 In  IP6 fe80::4dce:8485:1e0b:314a.63733 > ff02::c.1900: UDP, length 146
2025-12-08 16:12:01.557148 hdst-eth0 In  IP 150.244.64.1.8889 > 10.250.18.18.48064: tcp 0
2025-12-08 16:12:01.576780 hdst-eth0 In  IP 10.250.18.18.48064 > 150.244.64.1.8889: tcp 0
2025-12-08 16:12:01.598312 hdst-eth0 In  IP 150.244.64.1.8889 > 10.250.18.18.48064: tcp 76
2025-12-08 16:12:01.616234 hdst-eth0 In  IP 10.250.18.18.48064 > 150.244.64.1.8889: tcp 0
2025-12-08 16:12:01.637460 hdst-eth0 In  IP 10.250.18.18.48064 > 150.244.64.1.8889: tcp 90
2025-12-08 16:12:01.657034 hdst-eth0 In  IP 150.244.64.1.8889 > 10.250.18.18.48064: tcp 0
2025-12-08 16:12:01.681156 hdst-eth0 In  IP 150.244.64.1.8889 > 10.250.18.18.48064: tcp 0
2025-12-08 16:12:01.703956 hdst-eth0 In  IP 10.250.18.18.48064 > 150.244.64.1.8889: tcp 0
2025-12-08 16:12:01.740462 hdst-eth0 In  IP 150.244.64.1.8889 > 10.250.18.18.48064: tcp 0
2025-12-08 16:12:01.762048 hdst-eth0 In  Loopback, skipCount 32769 (bogus) (invalid)
2025-12-08 16:12:01.778024 hdst-eth0 In  IP 10.250.18.18.44344 > 150.244.64.1.8889: tcp 0
2025-12-08 16:12:01.798052 hdst-eth0 In  IP 150.244.64.1.8889 > 10.250.18.18.44344: tcp 0
2025-12-08 16:12:01.817866 hdst-eth0 In  IP 10.250.18.18.44344 > 150.244.64.1.8889: tcp 0
2025-12-08 16:12:01.843211 hdst-eth0 In  IP 150.244.64.1.8889 > 10.250.18.18.44344: tcp 76
2025-12-08 16:12:01.857907 hdst-eth0 In  IP 10.250.18.18.44344 > 150.244.64.1.8889: tcp 0
2025-12-08 16:12:01.880136 hdst-eth0 In  IP 10.250.18.18.44344 > 150.244.64.1.8889: tcp 90
2025-12-08 16:12:01.898863 hdst-eth0 In  IP 150.244.64.1.8889 > 10.250.18.18.44344: tcp 0
2025-12-08 16:12:01.924134 hdst-eth0 In  IP 150.244.64.1.8889 > 10.250.18.18.44344: tcp 0
2025-12-08 16:12:01.939128 hdst-eth0 In  IP 10.250.18.18.44344 > 150.244.64.1.8889: tcp 0
2025-12-08 16:12:01.953905 hdst-eth0 In  IP 150.244.64.1.8889 > 10.250.18.18.44344: tcp 0
2025-12-08 16:12:01.977983 hdst-eth0 In  IP 192.168.1.4.63735 > 239.255.255.250.1900: UDP, length 133
2025-12-08 16:12:01.999861 hdst-eth0 In  IP 192.168.1.4.138 > 192.168.1.255.138: UDP, length 174
2025-12-08 16:12:02.019173 hdst-eth0 In  IP 192.168.1.4.49885 > 8.8.8.8.53: UDP, length 43
2025-12-08 16:12:02.039753 hdst-eth0 In  IP 192.168.1.4.138 > 192.168.1.255.138: UDP, length 174
2025-12-08 16:12:02.065770 hdst-eth0 In  IP6 fe80::4dce:8485:1e0b:314a.546 > ff02::1:2.547: UDP, length 83
2025-12-08 16:12:02.084118 hdst-eth0 In  IP6 fe80::4dce:8485:1e0b:314a.63733 > ff02::c.1900: UDP, length 146
2025-12-08 16:12:02.106792 hdst-eth0 In  IP6 fe80::4dce:8485:1e0b:314a > ff02::1:ff16:a07a: ICMP6, neighbor solicitation, who has fe80::7144:1beb:fc16:a07a, length 32
2025-12-08 16:12:02.122076 hdst-eth0 In  IP 192.168.1.4.1900 > 239.255.255.250.1900: UDP, length 513
2025-12-08 16:12:02.150151 hdst-eth0 In  Loopback, skipCount 32769 (bogus) (invalid)
2025-12-08 16:12:02.174031 hdst-eth0 In  IP 10.250.18.18.44354 > 150.244.64.1.8889: tcp 0
2025-12-08 16:12:02.196245 hdst-eth0 In  IP 150.244.64.1.8889 > 10.250.18.18.44354: tcp 0
2025-12-08 16:12:02.224171 hdst-eth0 In  IP 10.250.18.18.44354 > 150.244.64.1.8889: tcp 0
2025-12-08 16:12:02.244178 hdst-eth0 In  IP 150.244.64.1.8889 > 10.250.18.18.44354: tcp 76
2025-12-08 16:12:02.266118 hdst-eth0 In  IP 10.250.18.18.44354 > 150.244.64.1.8889: tcp 0
2025-12-08 16:12:02.280002 hdst-eth0 In  IP 10.250.18.18.44354 > 150.244.64.1.8889: tcp 90
2025-12-08 16:12:02.298219 hdst-eth0 In  IP 150.244.64.1.8889 > 10.250.18.18.44354: tcp 0
2025-12-08 16:12:02.320205 hdst-eth0 In  IP 150.244.64.1.8889 > 10.250.18.18.44354: tcp 0
2025-12-08 16:12:02.342392 hdst-eth0 In  IP 10.250.18.18.44354 > 150.244.64.1.8889: tcp 0
2025-12-08 16:12:02.369212 hdst-eth0 In  IP 150.244.64.1.8889 > 10.250.18.18.44354: tcp 0
2025-12-08 16:12:02.387659 hdst-eth0 In  ifindex 2 00:00:00:00:01:01 
2025-12-08 16:12:02.415105 hdst-eth0 In  IP6 fe80::4dce:8485:1e0b:314a.1900 > ff02::c.1900: UDP, length 523
2025-12-08 16:12:02.429873 hdst-eth0 In  IP 192.168.1.4.58572 > 239.255.255.250.3702: UDP, length 991
2025-12-08 16:12:02.452988 hdst-eth0 In  IP6 fe80::4dce:8485:1e0b:314a.58573 > ff02::c.3702: UDP, length 991
2025-12-08 16:12:02.470513 hdst-eth0 In  IP 192.168.1.4.58572 > 239.255.255.250.3702: UDP, length 991
2025-12-08 16:12:02.494785 hdst-eth0 In  IP6 fe80::4dce:8485:1e0b:314a.58573 > ff02::c.3702: UDP, length 991
2025-12-08 16:12:02.513894 hdst-eth0 In  IP6 fe80::4dce:8485:1e0b:314a > ff02::16: HBH ICMP6, multicast listener report v2, 1 group record(s), length 28
2025-12-08 16:12:02.535244 hdst-eth0 In  IP6 fe80::4dce:8485:1e0b:314a > ff02::16: HBH ICMP6, multicast listener report v2, 1 group record(s), length 28
2025-12-08 16:12:02.555193 hdst-eth0 In  IP6 fe80::4dce:8485:1e0b:314a.49702 > ff02::1:3.5355: UDP, length 21
2025-12-08 16:12:02.580249 hdst-eth0 In  IP6 fe80::4dce:8485:1e0b:314a.49890 > ff02::c.1900: UDP, length 123
2025-12-08 16:12:02.595832 hdst-eth0 In  IP6 fe80::4dce:8485:1e0b:314a.49890 > ff02::c.1900: UDP, length 91
2025-12-08 16:12:02.622142 hdst-eth0 In  IP6 fe80::4dce:8485:1e0b:314a.49702 > ff02::1:3.5355: UDP, length 21
2025-12-08 16:12:02.649402 hdst-eth0 In  IP6 fe80::4dce:8485:1e0b:314a.1900 > ff02::c.1900: UDP, length 509
2025-12-08 16:12:02.665794 hdst-eth0 In  Loopback, skipCount 32769 (bogus) (invalid)
2025-12-08 16:12:02.684817 hdst-eth0 In  IP 10.250.18.18.44364 > 150.244.64.1.8889: tcp 0
2025-12-08 16:12:02.705098 hdst-eth0 In  IP 150.244.64.1.8889 > 10.250.18.18.44364: tcp 0
2025-12-08 16:12:02.721130 hdst-eth0 In  IP 10.250.18.18.44364 > 150.244.64.1.8889: tcp 0
2025-12-08 16:12:02.747131 hdst-eth0 In  IP 150.244.64.1.8889 > 10.250.18.18.44364: tcp 76
2025-12-08 16:12:02.769016 hdst-eth0 In  IP 10.250.18.18.44364 > 150.244.64.1.8889: tcp 0
2025-12-08 16:12:02.790183 hdst-eth0 In  IP 10.250.18.18.44364 > 150.244.64.1.8889: tcp 90
2025-12-08 16:12:02.811852 hdst-eth0 In  IP 150.244.64.1.8889 > 10.250.18.18.44364: tcp 0
2025-12-08 16:12:02.837833 hdst-eth0 In  IP6 fe80::4dce:8485:1e0b:314a.49890 > ff02::c.1900: UDP, length 119
2025-12-08 16:12:02.851815 hdst-eth0 In  IP6 fe80::4dce:8485:1e0b:314a > ff02::1:ff16:a07a: ICMP6, neighbor solicitation, who has fe80::7144:1beb:fc16:a07a, length 32
2025-12-08 16:12:02.875932 hdst-eth0 In  IP6 fe80::4dce:8485:1e0b:314a > ff02::16: HBH ICMP6, multicast listener report v2, 1 group record(s), length 28
2025-12-08 16:12:02.895884 hdst-eth0 In  IP6 fe80::4dce:8485:1e0b:314a > ff02::16: HBH ICMP6, multicast listener report v2, 1 group record(s), length 28
2025-12-08 16:12:02.932201 hdst-eth0 In  IP 150.244.64.1.8889 > 10.250.18.18.44364: tcp 0
2025-12-08 16:12:02.947885 hdst-eth0 In  IP 10.250.18.18.44364 > 150.244.64.1.8889: tcp 0
2025-12-08 16:12:02.964166 hdst-eth0 In  IP 150.244.64.1.8889 > 10.250.18.18.44364: tcp 0
2025-12-08 16:12:02.982056 hdst-eth0 In  Loopback, skipCount 32769 (bogus) (invalid)
2025-12-08 16:12:03.005358 hdst-eth0 In  IP 10.250.18.18.44380 > 150.244.64.1.8889: tcp 0
2025-12-08 16:12:03.027059 hdst-eth0 In  IP 150.244.64.1.8889 > 10.250.18.18.44380: tcp 0
2025-12-08 16:12:03.053259 hdst-eth0 In  IP 10.250.18.18.44380 > 150.244.64.1.8889: tcp 0
2025-12-08 16:12:03.073004 hdst-eth0 In  IP 150.244.64.1.8889 > 10.250.18.18.44380: tcp 76
2025-12-08 16:12:03.133267 hdst-eth0 In  IP 10.250.18.18.44380 > 150.244.64.1.8889: tcp 0
2025-12-08 16:12:03.151663 hdst-eth0 In  IP 10.250.18.18.44380 > 150.244.64.1.8889: tcp 90
2025-12-08 16:12:03.165502 hdst-eth0 In  IP 150.244.64.1.8889 > 10.250.18.18.44380: tcp 0
2025-12-08 16:12:03.181680 hdst-eth0 In  IP 150.244.64.1.8889 > 10.250.18.18.44380: tcp 0
2025-12-08 16:12:03.197975 hdst-eth0 In  IP 10.250.18.18.44380 > 150.244.64.1.8889: tcp 0
2025-12-08 16:12:03.211855 hdst-eth0 In  IP 150.244.64.1.8889 > 10.250.18.18.44380: tcp 0
2025-12-08 16:12:03.226858 hdst-eth0 In  Loopback, skipCount 32769 (bogus) (invalid)
2025-12-08 16:12:03.241440 hdst-eth0 In  ifindex 2 00:00:00:00:01:01 
2025-12-08 16:12:03.263475 hdst-eth0 In  IP6 fe80::4dce:8485:1e0b:314a > ff02::16: HBH ICMP6, multicast listener report v2, 1 group record(s), length 28
2025-12-08 16:12:03.285038 hdst-eth0 In  IP6 fe80::4dce:8485:1e0b:314a.61686 > ff02::1:3.5355: UDP, length 21
2025-12-08 16:12:03.298865 hdst-eth0 In  IP6 fe80::4dce:8485:1e0b:314a.49890 > ff02::c.1900: UDP, length 117
2025-12-08 16:12:03.317116 hdst-eth0 In  IP6 fe80::4dce:8485:1e0b:314a.546 > ff02::1:2.547: UDP, length 83
2025-12-08 16:12:03.346101 hdst-eth0 In  ARP, Request who-has 10.250.18.18 tell 10.250.18.254, length 46
2025-12-08 16:12:03.366890 hdst-eth0 In  ARP, Reply 10.250.18.18 is-at c8:d3:ff:bd:9a:aa, length 28
2025-12-08 16:12:03.386016 hdst-eth0 In  IP 10.250.18.18.44386 > 150.244.64.1.8889: tcp 0
2025-12-08 16:12:03.411060 hdst-eth0 In  IP 150.244.64.1.8889 > 10.250.18.18.44386: tcp 0
2025-12-08 16:12:04.063406 hdst-eth0 In  IP 10.250.18.18.48036 > 150.244.64.1.8889: tcp 0
2025-12-08 16:12:04.081377 hdst-eth0 In  IP 150.244.64.1.8889 > 10.250.18.18.48036: tcp 0
2025-12-08 16:12:04.095380 hdst-eth0 In  IP 10.250.18.18.48036 > 150.244.64.1.8889: tcp 0
2025-12-08 16:12:04.110590 hdst-eth0 In  IP 150.244.64.1.8889 > 10.250.18.18.48036: tcp 76
2025-12-08 16:12:04.131450 hdst-eth0 In  IP 10.250.18.18.48036 > 150.244.64.1.8889: tcp 0
2025-12-08 16:12:04.150176 hdst-eth0 In  IP 10.250.18.18.48036 > 150.244.64.1.8889: tcp 90
2025-12-08 16:12:04.166073 hdst-eth0 In  IP 150.244.64.1.8889 > 10.250.18.18.48036: tcp 0
2025-12-08 16:12:04.186122 hdst-eth0 In  IP 150.244.64.1.8889 > 10.250.18.18.48036: tcp 0
2025-12-08 16:12:04.214097 hdst-eth0 In  ARP, Request who-has 192.168.1.4 tell 0.0.0.0, length 28
2025-12-08 16:12:04.241433 hdst-eth0 In  IP 192.168.1.4 > 224.0.0.22: igmp
2025-12-08 16:12:04.260673 hdst-eth0 In  IP6 :: > ff02::1:ff0b:314a: ICMP6, neighbor solicitation, who has fe80::4dce:8485:1e0b:314a, length 24
2025-12-08 16:12:04.286783 hdst-eth0 In  IP6 fe80::4dce:8485:1e0b:314a > ff02::2: ICMP6, router solicitation, length 16
2025-12-08 16:12:04.320097 hdst-eth0 In  IP6 fe80::4dce:8485:1e0b:314a > ff02::16: HBH ICMP6, multicast listener report v2, 2 group record(s), length 48
2025-12-08 16:12:04.335782 hdst-eth0 In  IP 192.168.1.4 > 224.0.0.22: igmp
2025-12-08 16:12:04.351932 hdst-eth0 In  IP6 fe80::4dce:8485:1e0b:314a > ff02::16: HBH ICMP6, multicast listener report v2, 2 group record(s), length 48
2025-12-08 16:12:04.366602 hdst-eth0 In  ARP, Request who-has 192.168.1.4 tell 0.0.0.0, length 28
2025-12-08 16:12:04.394913 hdst-eth0 In  IP6 fe80::4dce:8485:1e0b:314a > ff02::16: HBH ICMP6, multicast listener report v2, 1 group record(s), length 28
2025-12-08 16:12:04.411813 hdst-eth0 In  IP 192.168.1.4 > 224.0.0.22: igmp
2025-12-08 16:12:04.432949 hdst-eth0 In  IP6 fe80::4dce:8485:1e0b:314a.49352 > ff02::1:3.5355: UDP, length 21
2025-12-08 16:12:04.459471 hdst-eth0 In  IP 192.168.1.4.49691 > 224.0.0.252.5355: UDP, length 21
2025-12-08 16:12:04.483218 hdst-eth0 In  IP 192.168.1.4.63735 > 239.255.255.250.1900: UDP, length 133
2025-12-08 16:12:04.498766 hdst-eth0 In  ARP, Request who-has 192.168.1.1 tell 192.168.1.4, length 28
2025-12-08 16:12:04.512744 hdst-eth0 In  ARP, Reply 192.168.1.1 is-at 52:54:00:12:35:00, length 28
2025-12-08 16:12:04.537124 hdst-eth0 In  IP 192.168.1.4.61237 > 8.8.8.8.53: UDP, length 34
2025-12-08 16:12:04.563173 hdst-eth0 In  IP6 fe80::4dce:8485:1e0b:314a.49352 > ff02::1:3.5355: UDP, length 21
2025-12-08 16:12:04.578040 hdst-eth0 In  IP 192.168.1.4.49691 > 224.0.0.252.5355: UDP, length 21
2025-12-08 16:12:04.594751 hdst-eth0 In  IP 192.168.1.4 > 224.0.0.22: igmp
2025-12-08 16:12:04.618158 hdst-eth0 In  IP6 fe80::4dce:8485:1e0b:314a > ff02::16: HBH ICMP6, multicast listener report v2, 1 group record(s), length 28
2025-12-08 16:12:04.646038 hdst-eth0 In  IP 10.250.18.18.48036 > 150.244.64.1.8889: tcp 0
2025-12-08 16:12:04.661140 hdst-eth0 In  IP 150.244.64.1.8889 > 10.250.18.18.48036: tcp 0
2025-12-08 16:12:04.686990 hdst-eth0 In  Loopback, skipCount 32769 (bogus) (invalid)
2025-12-08 16:12:04.706215 hdst-eth0 In  IP 10.250.18.18.41388 > 150.244.214.200.53: UDP, length 32
2025-12-08 16:12:04.733161 hdst-eth0 In  IP 150.244.214.200.53 > 10.250.18.18.41388: UDP, length 48
2025-12-08 16:12:04.748357 hdst-eth0 In  IP 10.250.18.18.41388 > 150.244.214.200.53: UDP, length 32
2025-12-08 16:12:04.764798 hdst-eth0 In  IP 150.244.214.200.53 > 10.250.18.18.41388: UDP, length 60
2025-12-08 16:12:04.780077 hdst-eth0 In  IP 10.250.18.18.58344 > 150.244.64.23.53: UDP, length 33
2025-12-08 16:12:04.799571 hdst-eth0 In  IP 150.244.64.23.53 > 10.250.18.18.58344: UDP, length 33
2025-12-08 16:12:04.826897 hdst-eth0 In  IP 10.250.18.18.48046 > 150.244.64.1.8889: tcp 0
2025-12-08 16:12:04.852059 hdst-eth0 In  IP 150.244.64.1.8889 > 10.250.18.18.48046: tcp 0
2025-12-08 16:12:04.870162 hdst-eth0 In  IP 10.250.18.18.48046 > 150.244.64.1.8889: tcp 0
2025-12-08 16:12:04.895224 hdst-eth0 In  IP 150.244.64.1.8889 > 10.250.18.18.48046: tcp 76
2025-12-08 16:12:04.909912 hdst-eth0 In  IP 10.250.18.18.48046 > 150.244.64.1.8889: tcp 0
2025-12-08 16:12:04.924029 hdst-eth0 In  IP 10.250.18.18.48046 > 150.244.64.1.8889: tcp 90
2025-12-08 16:12:04.937907 hdst-eth0 In  IP 150.244.64.1.8889 > 10.250.18.18.48046: tcp 0
2025-12-08 16:12:04.961971 hdst-eth0 In  IP 150.244.64.1.8889 > 10.250.18.18.48046: tcp 0
2025-12-08 16:12:04.982115 hdst-eth0 In  IP 10.250.18.18.48046 > 150.244.64.1.8889: tcp 0
2025-12-08 16:12:05.010177 hdst-eth0 In  IP 150.244.64.1.8889 > 10.250.18.18.48046: tcp 0
2025-12-08 16:12:05.030690 hdst-eth0 In  ifindex 2 00:00:00:00:01:01 
2025-12-08 16:12:05.062778 hdst-eth0 In  ARP, Request who-has 192.168.1.4 tell 0.0.0.0, length 28
2025-12-08 16:12:05.090842 hdst-eth0 In  IP 192.168.1.4.61237 > 8.8.8.8.53: UDP, length 34
2025-12-08 16:12:05.106793 hdst-eth0 In  IP6 fe80::4dce:8485:1e0b:314a > ff02::1:ff16:a07a: ICMP6, neighbor solicitation, who has fe80::7144:1beb:fc16:a07a, length 32
2025-12-08 16:12:05.126020 hdst-eth0 In  IP6 fe80::4dce:8485:1e0b:314a.63733 > ff02::c.1900: UDP, length 146
2025-12-08 16:12:05.151119 hdst-eth0 In  Loopback, skipCount 32769 (bogus) (invalid)
2025-12-08 16:12:05.166112 hdst-eth0 In  IP 10.250.18.18.48052 > 150.244.64.1.8889: tcp 0
2025-12-08 16:12:05.189230 hdst-eth0 In  IP 150.244.64.1.8889 > 10.250.18.18.48052: tcp 0
2025-12-08 16:12:05.207846 hdst-eth0 In  IP 10.250.18.18.48052 > 150.244.64.1.8889: tcp 0
2025-12-08 16:12:05.228141 hdst-eth0 In  IP 150.244.64.1.8889 > 10.250.18.18.48052: tcp 76
2025-12-08 16:12:05.241875 hdst-eth0 In  IP 10.250.18.18.48052 > 150.244.64.1.8889: tcp 0
2025-12-08 16:12:05.257033 hdst-eth0 In  IP 10.250.18.18.48052 > 150.244.64.1.8889: tcp 90
2025-12-08 16:12:05.284844 hdst-eth0 In  IP 150.244.64.1.8889 > 10.250.18.18.48052: tcp 0
2025-12-08 16:12:05.305764 hdst-eth0 In  IP6 fe80::4dce:8485:1e0b:314a > ff02::1:ff16:a07a: ICMP6, neighbor solicitation, who has fe80::7144:1beb:fc16:a07a, length 32
2025-12-08 16:12:05.335140 hdst-eth0 In  IP6 fe80::4dce:8485:1e0b:314a > ff02::16: HBH ICMP6, multicast listener report v2, 1 group record(s), length 28
2025-12-08 16:12:05.349781 hdst-eth0 In  IP 192.168.1.4 > 224.0.0.22: igmp
2025-12-08 16:12:05.370779 hdst-eth0 In  IP6 fe80::4dce:8485:1e0b:314a > ff02::16: HBH ICMP6, multicast listener report v2, 1 group record(s), length 28
2025-12-08 16:12:05.398725 hdst-eth0 In  IP 192.168.1.4 > 224.0.0.22: igmp
2025-12-08 16:12:05.423109 hdst-eth0 In  IP6 fe80::4dce:8485:1e0b:314a.53227 > ff02::1:3.5355: UDP, length 21
2025-12-08 16:12:05.437102 hdst-eth0 In  IP 192.168.1.4.55418 > 224.0.0.252.5355: UDP, length 21
2025-12-08 16:12:05.452085 hdst-eth0 In  IP 192.168.1.4.137 > 192.168.1.255.137: UDP, length 68
2025-12-08 16:12:05.487148 hdst-eth0 In  IP 150.244.64.1.8889 > 10.250.18.18.48052: tcp 0
2025-12-08 16:12:05.502276 hdst-eth0 In  IP 10.250.18.18.48052 > 150.244.64.1.8889: tcp 0
2025-12-08 16:12:05.519849 hdst-eth0 In  IP 150.244.64.1.8889 > 10.250.18.18.48052: tcp 0
2025-12-08 16:12:05.541861 hdst-eth0 In  Loopback, skipCount 32769 (bogus) (invalid)
2025-12-08 16:12:05.564141 hdst-eth0 In  IP 192.168.1.4.61237 > 8.8.8.8.53: UDP, length 34
2025-12-08 16:12:05.588290 hdst-eth0 In  IP6 fe80::4dce:8485:1e0b:314a.53227 > ff02::1:3.5355: UDP, length 21
2025-12-08 16:12:05.603117 hdst-eth0 In  IP 192.168.1.4.55418 > 224.0.0.252.5355: UDP, length 21
2025-12-08 16:12:05.619108 hdst-eth0 In  IP 192.168.1.4.137 > 192.168.1.255.137: UDP, length 68
2025-12-08 16:12:05.648094 hdst-eth0 In  IP 192.168.1.4.137 > 192.168.1.255.137: UDP, length 68
2025-12-08 16:12:05.664022 hdst-eth0 In  IP6 fe80::4dce:8485:1e0b:314a.53514 > ff02::1:3.5355: UDP, length 24
2025-12-08 16:12:05.688175 hdst-eth0 In  IP 192.168.1.4.53196 > 224.0.0.252.5355: UDP, length 24
2025-12-08 16:12:05.704181 hdst-eth0 In  IP 192.168.1.4.49885 > 8.8.8.8.53: UDP, length 43
2025-12-08 16:12:05.722980 hdst-eth0 In  IP6 fe80::4dce:8485:1e0b:314a.53514 > ff02::1:3.5355: UDP, length 24
2025-12-08 16:12:05.744207 hdst-eth0 In  IP 192.168.1.4.53196 > 224.0.0.252.5355: UDP, length 24
2025-12-08 16:12:05.765409 hdst-eth0 In  IP 192.168.1.4.137 > 192.168.1.255.137: UDP, length 50
2025-12-08 16:12:05.788117 hdst-eth0 In  IP 192.168.1.4 > 224.0.0.22: igmp
2025-12-08 16:12:05.808865 hdst-eth0 In  IP 10.250.18.18.41944 > 34.117.188.166.443: tcp 0
2025-12-08 16:12:05.835161 hdst-eth0 In  IP 34.117.188.166.443 > 10.250.18.18.41944: tcp 0
2025-12-08 16:12:05.848858 hdst-eth0 In  IP 10.250.18.18.41944 > 34.117.188.166.443: tcp 0
2025-12-08 16:12:05.862544 hdst-eth0 In  IP 10.250.18.18.41944 > 34.117.188.166.443: tcp 1252
2025-12-08 16:12:05.890837 hdst-eth0 In  IP6 fe80::4dce:8485:1e0b:314a > ff02::16: HBH ICMP6, multicast listener report v2, 1 group record(s), length 28
2025-12-08 16:12:05.914427 hdst-eth0 In  IP 192.168.1.4.137 > 192.168.1.255.137: UDP, length 68
2025-12-08 16:12:05.933187 hdst-eth0 In  IP 192.168.1.4.137 > 192.168.1.255.137: UDP, length 68
2025-12-08 16:12:05.953540 hdst-eth0 In  IP 192.168.1.4.137 > 192.168.1.255.137: UDP, length 68
2025-12-08 16:12:05.984167 hdst-eth0 In  IP 34.117.188.166.443 > 10.250.18.18.41944: tcp 0
2025-12-08 16:12:06.007158 hdst-eth0 In  IP 34.117.188.166.443 > 10.250.18.18.41944: tcp 212
2025-12-08 16:12:06.025907 hdst-eth0 In  IP 10.250.18.18.41944 > 34.117.188.166.443: tcp 0
2025-12-08 16:12:06.041127 hdst-eth0 In  IP 10.250.18.18.41944 > 34.117.188.166.443: tcp 64
2025-12-08 16:12:06.061800 hdst-eth0 In  IP6 fe80::4dce:8485:1e0b:314a > ff02::1:ff16:a07a: ICMP6, neighbor solicitation, who has fe80::7144:1beb:fc16:a07a, length 32
2025-12-08 16:12:06.076810 hdst-eth0 In  IP6 fe80::4dce:8485:1e0b:314a > ff02::2: ICMP6, router solicitation, length 16
2025-12-08 16:12:06.091938 hdst-eth0 In  IP 192.168.1.4.63735 > 239.255.255.250.1900: UDP, length 133
2025-12-08 16:12:06.110346 hdst-eth0 In  IP 192.168.1.4.49885 > 8.8.8.8.53: UDP, length 43
2025-12-08 16:12:06.141047 hdst-eth0 In  IP 10.250.18.18.41944 > 34.117.188.166.443: tcp 92
2025-12-08 16:12:06.156153 hdst-eth0 In  IP 10.250.18.18.41944 > 34.117.188.166.443: tcp 198
2025-12-08 16:12:06.172255 hdst-eth0 In  IP 34.117.188.166.443 > 10.250.18.18.41944: tcp 618
2025-12-08 16:12:06.189814 hdst-eth0 In  IP 34.117.188.166.443 > 10.250.18.18.41944: tcp 0
2025-12-08 16:12:06.225090 hdst-eth0 In  IP 34.117.188.166.443 > 10.250.18.18.41944: tcp 31
2025-12-08 16:12:06.239865 hdst-eth0 In  IP 10.250.18.18.41944 > 34.117.188.166.443: tcp 0
2025-12-08 16:12:06.256130 hdst-eth0 In  IP 10.250.18.18.41944 > 34.117.188.166.443: tcp 31
2025-12-08 16:12:06.277299 hdst-eth0 In  IP 34.117.188.166.443 > 10.250.18.18.41944: tcp 0
2025-12-08 16:12:06.304031 hdst-eth0 In  IP 34.117.188.166.443 > 10.250.18.18.41944: tcp 172
2025-12-08 16:12:06.321376 hdst-eth0 In  IP 34.117.188.166.443 > 10.250.18.18.41944: tcp 1400
2025-12-08 16:12:06.334965 hdst-eth0 In  IP 10.250.18.18.41944 > 34.117.188.166.443: tcp 0
2025-12-08 16:12:06.349065 hdst-eth0 In  IP 34.117.188.166.443 > 10.250.18.18.41944: tcp 1400
2025-12-08 16:12:06.370109 hdst-eth0 In  IP 34.117.188.166.443 > 10.250.18.18.41944: tcp 1400
2025-12-08 16:12:06.384891 hdst-eth0 In  IP 10.250.18.18.41944 > 34.117.188.166.443: tcp 0
2025-12-08 16:12:06.404062 hdst-eth0 In  IP 34.117.188.166.443 > 10.250.18.18.41944: tcp 1057
2025-12-08 16:12:06.417027 hdst-eth0 In  IP 34.117.188.166.443 > 10.250.18.18.41944: tcp 39
2025-12-08 16:12:06.443314 hdst-eth0 In  IP 192.168.1.4.137 > 192.168.1.255.137: UDP, length 50
2025-12-08 16:12:06.462216 hdst-eth0 In  IP 192.168.1.4.137 > 192.168.1.255.137: UDP, length 68
2025-12-08 16:12:06.478395 hdst-eth0 In  IP 192.168.1.4.137 > 192.168.1.255.137: UDP, length 68
2025-12-08 16:12:06.492816 hdst-eth0 In  IP 192.168.1.4.137 > 192.168.1.255.137: UDP, length 68
2025-12-08 16:12:06.523835 hdst-eth0 In  IP 10.250.18.18.41944 > 34.117.188.166.443: tcp 0
2025-12-08 16:12:06.542102 hdst-eth0 In  IP 10.250.18.18.41944 > 34.117.188.166.443: tcp 39
2025-12-08 16:12:06.556977 hdst-eth0 In  IP 34.117.188.166.443 > 10.250.18.18.41944: tcp 0
2025-12-08 16:12:06.570905 hdst-eth0 In  IP 10.250.18.18.48058 > 150.244.64.1.8889: tcp 0
2025-12-08 16:12:06.596098 hdst-eth0 In  IP 192.168.1.4.137 > 192.168.1.255.137: UDP, length 50
2025-12-08 16:12:06.619320 hdst-eth0 In  IP 192.168.1.4.61237 > 8.8.8.8.53: UDP, length 34
2025-12-08 16:12:06.631216 hdst-eth0 In  IP 192.168.1.4.49885 > 8.8.8.8.53: UDP, length 43
2025-12-08 16:12:06.644553 hdst-eth0 In  IP 192.168.1.4.137 > 192.168.1.255.137: UDP, length 68
2025-12-08 16:12:06.677109 hdst-eth0 In  IP 150.244.64.1.8889 > 10.250.18.18.48058: tcp 0
2025-12-08 16:12:06.691671 hdst-eth0 In  IP 10.250.18.18.48058 > 150.244.64.1.8889: tcp 0
2025-12-08 16:12:06.705669 hdst-eth0 In  IP 150.244.64.1.8889 > 10.250.18.18.48058: tcp 76
2025-12-08 16:12:06.717590 hdst-eth0 In  IP 10.250.18.18.48058 > 150.244.64.1.8889: tcp 0
2025-12-08 16:12:06.738626 hdst-eth0 In  IP 10.250.18.18.48058 > 150.244.64.1.8889: tcp 90
2025-12-08 16:12:06.752561 hdst-eth0 In  IP 150.244.64.1.8889 > 10.250.18.18.48058: tcp 0
2025-12-08 16:12:06.766573 hdst-eth0 In  IP 150.244.64.1.8889 > 10.250.18.18.48058: tcp 0
2025-12-08 16:12:06.784424 hdst-eth0 In  IP 10.250.18.18.48058 > 150.244.64.1.8889: tcp 0
2025-12-08 16:12:06.805708 hdst-eth0 In  IP 192.168.1.4.137 > 192.168.1.255.137: UDP, length 68
2025-12-08 16:12:06.821162 hdst-eth0 In  IP 192.168.1.4.137 > 192.168.1.255.137: UDP, length 68
2025-12-08 16:12:06.838477 hdst-eth0 In  IP6 fe80::4dce:8485:1e0b:314a.63733 > ff02::c.1900: UDP, length 146
2025-12-08 16:12:06.861012 hdst-eth0 In  IP6 fe80::4dce:8485:1e0b:314a > ff02::1:ff16:a07a: ICMP6, neighbor solicitation, who has fe80::7144:1beb:fc16:a07a, length 32
2025-12-08 16:12:06.886086 hdst-eth0 In  IP 192.168.1.4.137 > 192.168.1.255.137: UDP, length 68
2025-12-08 16:12:06.900828 hdst-eth0 In  IP6 fe80::4dce:8485:1e0b:314a > ff02::1:ff16:a07a: ICMP6, neighbor solicitation, who has fe80::7144:1beb:fc16:a07a, length 32
2025-12-08 16:12:06.916225 hdst-eth0 In  IP 192.168.1.4.137 > 192.168.1.255.137: UDP, length 68
2025-12-08 16:12:06.933034 hdst-eth0 In  IP 192.168.1.4.63735 > 239.255.255.250.1900: UDP, length 133
2025-12-08 16:12:06.959332 hdst-eth0 In  IP 150.244.64.1.8889 > 10.250.18.18.48058: tcp 0
2025-12-08 16:12:06.982884 hdst-eth0 In  Loopback, skipCount 32769 (bogus) (invalid)
2025-12-08 16:12:06.997272 hdst-eth0 In  IP 10.250.18.18.59648 > 150.244.214.200.53: UDP, length 33
2025-12-08 16:12:07.012146 hdst-eth0 In  IP 150.244.214.200.53 > 10.250.18.18.59648: UDP, length 49
2025-12-08 16:12:07.041148 hdst-eth0 In  IP 192.168.1.4.49885 > 8.8.8.8.53: UDP, length 43
2025-12-08 16:12:07.064703 hdst-eth0 In  IP6 fe80::4dce:8485:1e0b:314a > ff02::1:ff16:a07a: ICMP6, neighbor solicitation, who has fe80::7144:1beb:fc16:a07a, length 32
2025-12-08 16:12:07.077838 hdst-eth0 In  IP 192.168.1.4.137 > 192.168.1.255.137: UDP, length 68
2025-12-08 16:12:07.100349 hdst-eth0 In  IP6 fe80::4dce:8485:1e0b:314a > ff02::2: ICMP6, router solicitation, length 16
2025-12-08 16:12:07.124218 hdst-eth0 In  IP 10.250.18.18.59648 > 150.244.214.200.53: UDP, length 33
2025-12-08 16:12:07.147270 hdst-eth0 In  IP 150.244.214.200.53 > 10.250.18.18.59648: UDP, length 61
